_id,title,title_chinese,title_english,team,summary,summary_chinese,summary_english,salary,salary_english,createdAt,source_name,source_name_english,source_url,type,description,description_chinese,description_english,city,experience,is_remote
8eefd868eb93a516b73c883b347bed81,Enterprise Account Executive,,,Prokeep,,,,150-180K,,2026-01-08,Wellfound,Wellfound,https://wellfound.com/jobs/3718366-enterprise-account-executive,国外,"About Us

Prokeep is an Order Engine on a mission to empower distributors to win by turning every customer interaction into an order opportunity.
Trusted by 8,000+ distributor locations and 40,000+ users, Prokeep makes it easy for over 3 million contractors, technicians, plumbers, electricians, mechanics, and other skilled professionals to order parts, troubleshoot issues, and generally, get what they need and get on with their day.
Built for the $100+ billion distribution market, Prokeep eliminates missed opportunities caused by busy phone lines, scattered customer data, and passive sales habits. By centralizing communication and enabling proactive outreach, we help teams take more orders from any channel and get more orders by driving demand—fueling growth, stronger relationships, and greater impact across the supply chain.
Having recently secured a $25M Series A investment, we’re poised for rapid growth and innovation. If you're passionate about tackling complex challenges in a collaborative, fast-paced environment while contributing to an often-overlooked yet vital sector of the economy, we’d love to have you on board.
Let’s shape the future together—one order at a time!

Prokeep Values

Build Together. – Collaboration, camaraderie, and customer-focus are core to how we collectively work and win.
Own It. – Persistence and personal growth drive the results - and the rewards! - that we can all enjoy.
Be Humble. Be Human. – Respect and authenticity allow us to build meaningful and lasting relationships.
Have Fun! – Positivity, perseverance, and a bit of laughter all allow us to make an impact while enjoying the rollercoaster!

Your MIssion

Hunt and secure our largest partnerships. Reporting to the VP of Sales, the Enterprise Account Executive will drive new revenue by optimizing our sales funnel using outbound strategies and tactics while also capturing qualified inbounds.

Winning today started this morning as you directly engage with prospects to position Prokeep as their go to communication platform. Land and Expand is not a dirty word, it is a path to success we know well!

You know you are only as successful as the people around you, so you work hard to build a collaborative and high performing pipeline. To increase your success now and in the future, you will work closely with marketing and sales leaders to dive in with what we know works, PLUS run your own experiments because what works today, could always be improved tomorrow.

Primary Responsibilities

The focus will be on hunting and acquiring our largest partnerships by building and managing a list of target accounts, starting conversations, navigating organizations, scoping projects, negotiating and securing commitments, and helping our Product Team prioritize these will take us to the next level, together!

Build and manage a territory plan for our largest partnership opportunities
Navigate the entire sales journey by introducing and demonstrating our value proposition, creating excitement and enthusiasm, and culminating with securing partnership
Negotiate contracts and maximize product value
Accurately forecast revenue and consistently hit quarterly targets by closing new business
Build and execute professional services contracts to accelerate bringing new features to market
Work with the Account Management Team to facilitate a seamless transition to the post sales process
Travel to conferences and conduct prospect visits
Collaborate with Operations, Customer Success, Support teams to maintain a seamless client experience
Maintain a dialogue with the Product team to keep Prokeep’s product offering competitive
Travel requirement 25%

Qualifications (About You)

Required: 3+ years in a quota carrying role with proven success selling SaaS products to Large Enterprise Organizations
Experience selling and navigating multiple stakeholders at all levels of the organization, including Operations, IT, Sales, VP, and the C-suite.
You are Stubborn and Tactfully Aggressive. In a healthy productive startup way!
Insatiable hunger to deliver value to customers and internally within our organization
Nice to have 1+ years experience with SaaS tech startups, rapidly scaling revenue while managing the resource constraints of a startup environment
Ability to learn new technologies quickly; ideally familiar with SaaS application requirements.
Expert level pipeline management with a commitment to process and data
Superior communications skills (presentation, written, and verbal) and demonstrated ability to communicate/present effectively
Proven ability to work well under pressure in a fast paced environment
Creative thinker with the ability to troubleshoot issues quickly and effectively

Why Prokeep?

At Prokeep, we offer a dynamic, passionate, and collaborative work environment where innovation thrives. Here’s what you can expect:
Competitive Compensation:Reflecting your expertise and impact.
Equity Package: Your success is our success—share in the growth you’ll help create.
Comprehensive Benefits: Health, dental, vision, life, short & long-term disability, 401(k), and employee assistance program (EAP).
Flexible PTO: Recharge and refocus with the flexibility to manage your time with no preset limits
Continuous Growth: Yearly education stipend to support your professional development.",,,,3+ years,1
1ec0f4babc4cbac941dfa1438d4640fe,Crypto/Web3 Account Executive Manager/ Sales,,,Web3Firewall,,,,168-180K,,2026-01-08,Wellfound,Wellfound,https://wellfound.com/jobs/3093142-crypto-web3-account-executive-manager-sales,国外,"Must have professional digital assets/ web3 experience!

The Web3 Risk Business Development and Account Manager will play a critical role in expanding the company’s footprint in the Web3 risk and compliance landscape. This position will focus on identifying new business opportunities, nurturing client relationships, and providing risk management solutions tailored to the Web3 ecosystem. The role requires a deep understanding of blockchain technology, decentralized finance (DeFi), and regulatory requirements, as well as the ability to manage and grow a client portfolio while mitigating risks associated with Web3 technologies.

Key Responsibilities:

Identify, prospect, and engage with potential clients, including crypto exchanges, DeFi platforms, NFT projects, and Web3 enterprises.
Develop and execute go-to-market strategies to grow the company’s Web3 risk management solutions.
Collaborate with internal teams (product, legal, marketing) to shape the company's offerings, aligning with market demand and regulatory requirements.
Build strategic partnerships and alliances with key players in the blockchain ecosystem.
Stay up-to-date with industry trends, market movements, and regulatory changes that impact risk management in Web3.

Account Management:

Manage a portfolio of high-value clients, ensuring strong relationships, customer satisfaction, and retention.
Serve as the primary point of contact for clients regarding Web3 risk management solutions, compliance, and regulatory services.
Provide tailored risk assessments and advisory services to clients, helping them navigate the complexities of the Web3 landscape, including AML (Anti-Money Laundering), KYC (Know Your Customer), and sanctions compliance.
Work with clients to proactively identify potential risks and create mitigation strategies, including smart contract audits, security evaluations, and regulatory compliance monitoring.
Ensure clients are leveraging the company’s solutions to optimize performance, reduce risk, and stay compliant with international laws.

Risk and Compliance Strategy:

Collaborate with the legal and compliance teams to develop comprehensive risk management frameworks for Web3 clients.
Assist in the design and implementation of risk mitigation strategies, including financial risk modeling, security protocols, and market volatility management.
Provide industry insights and feedback to the product team to enhance existing risk management tools and develop new services.
Educate clients and partners on best practices for security, fraud prevention, and compliance within the Web3 ecosystem.

Performance Tracking and Reporting:

Set clear performance metrics for business growth and account success, and provide regular reports to leadership on sales pipeline, client satisfaction, and risk-related concerns.
Track market trends, competitive landscape, and client feedback to adjust sales strategies and drive continuous improvement.

Qualifications:

Education: Bachelor’s degree in Business, Finance, Economics, Risk Management, or a related field. Advanced degrees or certifications in blockchain, risk management, or compliance are a plus.

Experience:

5+ years of experience in business development, account management, or risk management in the Web3, blockchain, or fintech sectors.
Proven track record of managing high-value client relationships and developing business within a technical or highly regulated industry.
Experience with risk assessment, compliance, and regulatory standards related to blockchain, cryptocurrency, and decentralized finance (DeFi).

Skills:

Deep understanding of blockchain technology, decentralized finance (DeFi), and Web3 infrastructure.
Strong knowledge of regulatory requirements (e.g., AML, KYC, OFAC sanctions) and how they apply to Web3 projects.
Excellent communication, negotiation, and presentation skills.
Ability to manage multiple client accounts and a sales pipeline effectively.
Analytical and strategic mindset, with the ability to identify and solve complex problems.
Familiarity with Web3 risk management tools such as blockchain explorers, smart contract auditing platforms, and compliance software.

Personal Attributes:

Entrepreneurial mindset with the ability to work independently and within a team.
Strong interpersonal skills and the ability to build lasting relationships with clients and partners.
A passion for blockchain, cryptocurrency, and Web3 technology.

Compensation:

Competitive salary with performance-based bonuses.
Equity options in a fast-growing Web3 risk management firm.",,,San Francisco,5+ years,1
336b5563d139cb028f7a044853517621,"Staff Software Engineer (SDK), Cloud Platform",,,IonQ,,,,97-140K,,2026-01-06,Wellfound,Wellfound,https://wellfound.com/jobs/3351553-staff-software-engineer-sdk-cloud-platform,国外,"We don’t just build the world’s best quantum computers–we want them to be usable by everyone, everywhere. We are looking for a Staff Software Engineer to join a cross-functional team building the IonQ Cloud Platform, which connects our customers to our quantum computers via APIs, SDKs, tools, and partner clouds like AWS, GCP, and Azure. You’ll lead development of our quantum software development kits like Qiskit, Cirq, and more, in collaboration with our product team, applications team, systems team, and scientists to build the best quantum developer experience for our customers and partners.

Responsibilities :

Reporting to the Senior Manager of Cloud Engineering, this role involves close collaboration with Product and Application teams to ensure the development of high-quality, user-friendly, and comprehensively documented SDKs that fulfill specified requirements.
Lead the design, development, and maintenance of robust, high-quality SDK features capabilities enabling quantum novices and experts alike to solve real-world problems with quantum computers
Mentor senior and junior engineers on the team
Participate in on-call rotations

You’d be a good fit with:

Bachelor's degree in Computer Science, Engineering or a related field, or equivalent training, fellowship, or work experience
8+ years of professional experience in software engineering, working in a team environment.
5+ years of experience in leading the design, development, and maintenance of robust, high-quality SDKs
Proficiency in Python
Experience in mentoring and guiding engineers of all levels to ensure a high bar for code quality and performance
Experience in driving the team's long-term vision and architecture, shaping roadmaps, and providing technical leadership
Experience in collaborating with product and other engineering teams to ensure alignment and effective communication.
Experience in identifying and solving complex technical challenges related to SDK development, performance, and integration
Demonstrated experience in prioritizing user-friendliness and seamless integration of SDKs for developer adoption
Demonstrated ability to remain current with industry trends, upstream software modifications, and advancements within the SDK ecosystem
Experience in creating and maintaining clear and comprehensive documentation

You’d be a great fit with:

10+ years of professional software experience
7+ years in leading the design, development, and maintenance of robust, high-quality SDKs
Experience with system-level programming languages like C++ or Rust
Proficiency in quantum computing SDKs (Qiskit, Pennylane, CirQ)
Some experience with quantum computing or quantum physics

Location: This position can work onsite or hybrid from one of our offices (College Park, MD, Bothell, WA) or fully remote in the US.

Travel: About once per quarter

Job ID: 1105

The approximate base salary range for this position is $162,920 - $213,304. The total compensation package includes base, bonus, and equity.",,,Seattle • College Park,7+ years,1
1dd613bac66ab05dec1b03de37782bc0,Senior Frontend Engineer,,,Locker (Want Locker),,,,84-96K·0.1%–0.2%股,,2026-01-09,Wellfound,Wellfound,https://wellfound.com/jobs/3236793-senior-frontend-engineer,国外,"At Locker, we have created a consumer shopping platform that revolutionizes the way consumers shop, and is democratizing curation and affiliate earning for the everyday consumer. Locker was named among the top 5 commerce startups and among the top 50 startups in 2024 by The Information. We are a seed stage startup, and have raised $3.5M in funding, with our seed round led by Wonder Ventures.

Locker is seeking a senior frontend engineer to join our team. In this role you will be responsible for delivering world-class UI to our user base, using your wide range of skills and expertise working in a product-driven organization.

We are a remote team, mostly located in the Los Angeles area with occasional meetings on-site.

Why join Locker’s Engineering team?
-Great team dynamics - we care more about whether someone is a good personality fit than whether they know every single area of our technical stack.
-Great company culture - we love working with each other and we put in the time and effort to make Locker a great place to work.
-Empathy-driven decision-making - we make decisions based on caring deeply about the customer experience.
-Everyone has a voice - no matter your position in the company, your ideas will be respected and heard.
-Strong technical drive - our team’s tech experience is diverse, and we care deeply about the technical decisions we make.
-Strong quality drive - we want to write the best code we’ve ever written, build the best products we’ve ever built, and have high standards for what we do.

What you’ll bring to the team:
-A deep love of engineering. You care about the code you write and you have strong opinions about what makes good code (these don’t need to be the same strong opinions as the rest of the team).
-You’re great to work with. Every colleague you have is excited to collaborate with you on a day to day basis. You’ll help contribute to the company culture and make Locker a great place to work.
-You’re great to discuss solutions with. You’re committed to finding the best answer for any problem, whether it was the idea you thought of first or not. You don’t mind admitting you’re wrong and have a healthy attitude to changing your mind. You value the expertise and input of others, and freely share yours.
-You’re light on your feet. You’re comfortable working on an agile team at a small start-up, and you understand that priorities change and sometimes hours run late. You’re adaptable and you don’t mind jumping in when someone else on the team needs help.
-You’re excited about our mission. You love the idea of shaping the future of commerce, and the democratization of the creator economy.

What you’ll do:
-Work on our Agile team to ship high-quality releases fast and often.
-Play a critical role in maintaining and developing our frontend features.
-Help plan, design, implement and maintain features.

Our tech stack:
Node.js
Next.js
Vercel
Express
GraphQL
Postgres
React Native
GCP (Cloud Run, Cloud SQL, Pub/Sub, BigQuery)
Terraform
Sentry
Metabase

Skills and qualifications we’re looking for:
-5+ years of experience working at growth-focused, early-to-mid stage startups.
-Domain expertise in commerce and the creator economy.
-A degree in Computer Science, Engineering, or a related field.
-Experience building React frontends as part of a startup product team.
-Familiarity with most or at least a good chunk of our tech stack.
-Experience with Agile software development methodologies.

What We Offer:
-A pivotal role in a rapidly growing startup set to revolutionize the consumer and creator economy. It’s a small team and everyone is vital for our success.
-Substantial equity stake in the startup, aligning your success with ours, competitive base salary, and health benefits.
-The opportunity to shape the future of commerce with a diverse group of successful, talented and motivated colleagues.

Apply now to join our team!",,,Los Angeles,5+ years,1
2cc4aec1c34d566a00ff2ab5530e0871,Frontend Developer,,,Avochato,,,,90K,,2026-01-08,Wellfound,Wellfound,https://wellfound.com/jobs/3718309-frontend-developer,国外,"Company Description

Avochato is an AI-based messaging platform designed to help businesses improve customer communication through a unified inbox supporting SMS, MMS, RCS, Live Chat, and Voice. Over the past decade, Avochato has grown into a reliable and profitable platform that powers customer interactions and generates revenue for organizations of all sizes. With a commitment to solving high-impact problems and delivering seamless products across desktop and mobile, Avochato ensures businesses can communicate with their customers in the most rewarding ways. Avochato is a team of builders who care deeply about product quality, customer satisfaction, and moving fast without breaking trust. It’s easy to launch something, but it’s much harder to make it last. That’s the work team Avochato enjoys and the mindset that unifies the entire team.

Role Description

This is a full-time remote role for a Frontend Developer located in the United States. As a React/TypeScript specialist, this role also serves as a technical resource for frontend best practices, code review standards, and team mentorship.

The Frontend Developer will be responsible for designing, building, and improving user interfaces that enhance the customer experience. Key responsibilities include collaborating in cross-functional project teams, maintaining responsive web designs, debugging issues, ensuring high performance of web applications, and staying up-to-date with industry trends and technologies.

Qualifications

4+ years of professional experience with React with production TypeScript usage
Strong experience with React state management (Redux, Zustand, or similar)
Strong experience writing frontend tests (Jest, Vitest, Testing Library, or similar)
Experience with WebSockets
Familiarity with build tooling (Webpack, Vite)
Experience working with RESTful APIs and async data patterns
Experience in a Rails-backed environment is a plus
Experience using AWS services (S3, CloudFront) and web accessibility standards (WCAG) are a plus",,,,5+ years,1
