_id,title,title_chinese,title_english,team,summary,summary_chinese,summary_english,salary,salary_english,createdAt,source_name,source_name_english,source_url,type,description,description_chinese,description_english,city,experience,is_remote
f4763e556bfbcceffd02252e4a0886a5,Business Development Representative - Ecosystem Specialist - US East Coast,,,Crossbeam,,,,42-45K,,2026-01-09,Wellfound,Wellfound,https://wellfound.com/jobs/3722065-business-development-representative-ecosystem-specialist-us-east-coast,国外,"APPLY HERE

About Crossbeam
It’s an exciting time at Crossbeam. We built our company on a simple but powerful realization: partner ecosystems hold untapped potential to transform how companies go to market. That insight became a movement, now embraced by more than 30,000 companies using Crossbeam to unlock new data, build new growth engines, and provide powerful new market context to their AI agents. We’re scaling with speed, focus, and a vision that’s reshaping the future of go-to-market, backed by top-tier investors like Andreessen Horowitz, Insight Partners, Redpoint, FirstMark, Salesforce Ventures, and HubSpot Ventures (yep, the biggest CRMs are investing in the future of go-to-market).

The opportunity ahead is exciting, and we’re pursuing it with curiosity, high standards, and a shared commitment to doing the best work of our careers.

At Crossbeam, we’re redefining how companies grow by putting ecosystems at the heart of go-to-market strategy.

We’re looking for a motivated and ecosystem-minded BDR - Ecosystem Specialist to join our Business Development team. In this role, you’ll manage a mix of strategic customer accounts (our “Gravity Nodes”) and high-potential prospects. Your focus: generate pipeline and accelerate deals by activating partner relationships and leveraging ecosystem signals.

This isn’t a typical BDR role, you’ll sit at the intersection of Sales, Partnerships, and Customer Success, driving Ecosystem-Led Growth (ELG). By activating partner networks and turning ecosystem insights into opportunities, you’ll accelerate revenue and help companies grow through each other.

What You’ll Do

Drive pipeline with customer ecosystems

Own a portfolio of Gravity Node accounts (our top customers with large ecosystems).
Partner with customer teams to identify and activate their most strategic partners on Crossbeam.
Become the go-to BD point of contact for onboarding and activating those partners, surfacing qualified opportunities for AEs.

Generate new business with product and ecosystem signals

Manage a portfolio of cold prospects and free users.
Use ecosystem overlaps, partner insights, and product usage data to prioritize outreach.
Create warm entry points and book high-quality first meetings with prospects.

Onboard and activate new users

Guide new users through setup and help them realize initial value.
Ensure seamless onboarding until accounts are ready for Sales qualification.

Collaborate cross-functionally

Work closely with Sales, Partnerships, and Customer Success to bring Ecosystem Led Growth to life at every stage of the sales cycle.
Share partner insights, influence pipeline, and support strategic initiatives with other GTM teams.

Stay current and contribute

Stay on top of ecosystem trends, GTM strategies, and use cases.
Share learnings and help shape how Crossbeam and our customers win through partnerships.

Success Looks Like

Consistently hitting monthly and quarterly pipeline targets.
Activating and onboarding new users successfully.
Helping AEs identify more opportunities and close deals faster through ecosystem engagement.

APPLY HERE

Who you are

2+ years as an Enterprise BDR, BDR Lead, Partner Manager, or Partner Sales Rep.
Demonstrated drive, grit, creativity, and proactivity. Are target-driven and love turning warm signals into real pipelines.
Ask great questions, stay curious, and are always ready to learn
Comfortable working with strategic/enterprise accounts and complex org structures. Can hold a confident, thoughtful conversation with execs and users alike
Strong communicator
CRM experience (Salesforce preferred; Salesloft or similar a plus).
Bonus: Partnerships experience or Crossbeam product knowledge; exposure to AI-driven tools or data enrichment platforms.

Interview Process
We go through the same interview steps for all Business Development candidates to ensure equity in our hiring process. Our process is designed to learn as much about each candidate as possible, as well as to give candidates access to our team and learn about what it's like to be a team member at Crossbeam. Topics will range from technical skills to problem-solving approaches and collaboration.

HR interview - 30 minutes
Call with Director of Business Development - 30 minutes
Business case presentation with Sales leader - 30 minutes
Call with CRO or COO - 30 minutes

*Benefits *
This is a salaried role + commission. In addition, Crossbeam offers:

Health Care Plan (Medical, Dental & Vision)
Flexible PTO Policy
Parental leave
Stock Option Plan
401k Plan + Match
Learning & Development Budget
Remote Work Options
Generous Wellness Stipend*

This role has been categorized as a Hybrid, Philadelphia-based position. In certain cases, an employee in a remote-designated job may need to live in a specific region or time zone to support customers or clients as part of their role. In addition to a competitive base salary this position is also eligible for equity awards based on factors such as experience, performance and location. Actual amounts will vary depending on experience, performance and location.

Our Core Values
Values are a social contract that we have with our team, our users, and our communities. They are guiding lights as well as argument-enders, and we expect results delivered in a way that is consistent with these values.

Trust is our Foundation

We create value by building trust in our company, our team, and our technology. That goes in all directions, not just between us and our customers but also amongst ourselves. We approach conflict with empathy and curiosity, and ascribe best intentions to all of our collaborators.

Work Hard and Smart

This is a startup, and we will act like one. We prioritize impact, take personal ownership of outcomes, act decisively, and get our hands dirty in the process. We communicate clearly, avoid over-engineering, and take risks. This allows us to be creative, innovative, and solution-oriented.

Default to Transparency

We will not succeed in information silos. We share the good, bad, and ugly about what is happening in our company, which requires us to pay attention, always measure what matters, and hold each other accountable.

Belonging

In our workplaces, communities, and ecosystems, we shape environments where people feel a sense of belonging. To do this, we work to ensure that stakeholders of all backgrounds are treated equitably and experience psychological and physical safety. This is key to their relationship with our company, their access to opportunities, and their ability to thrive.

Treasure the Fun

We are incredibly lucky to be here — let’s make memories. We will all spend that extra bit of time and energy to energize each other with fun and inspiring experiences. This applies internally and externally, from the smallest interactions to the largest events.

Crossbeam's core value of Equity sits at the heart of our hiring process, and we're proud to be building a culture where difference is valued. Applicants from diverse and non-traditional backgrounds are strongly encouraged to apply. We recruit, employ, train, compensate and promote regardless of race, religion, color, national origin, sex, sexual orientation, gender, disability, age, or veteran status.
**
Equal Opportunity Employer**

We’re proud to be an Equal Opportunity Employer and are committed to building a team that reflects a wide variety of backgrounds, perspectives, and skills. We don’t discriminate on the basis of race, color, religion, national origin, age, sex, gender identity or expression, sexual orientation, disability, veteran status, genetic information, or any other protected characteristic.

If you need reasonable accommodations during any part of the application or interview process, please let us know—we’re happy to support you.",,,Boston • New York City • Philadelphia,2+ years,1
6241734a3073b0c48856b36826b3fa99,Web3 / Full-stack Software Engineer,,,stakefish,,,,,,,Wellfound,Wellfound,https://wellfound.com/jobs/3045019-web3-full-stack-software-engineer,国外,,,,,,1
bef191fcf6999f26b7769361b2fff54c,Senior/Staff Software Engineer (Platform),,,Konko AI,,,,84-132K·0.1%–1.0%股,,2026-01-09,Wellfound,Wellfound,https://wellfound.com/jobs/3722136-senior-staff-software-engineer-platform,国外,"The Company

Konko AI is building the agent-native EHR for Latin America. Our AI agents take work off the clinic’s plate—automating intake, transcription, data capture, scheduling, and follow-ups—while turning unstructured workflows into structured, auditable clinical data. Clinics see 20–50% growth, staff reclaim 3–4 hours per day, and patients get a faster, clearer experience. We’re an experienced, high-bar team (Tesla, C3 AI, BCG, Harvard, UCLA, Georgia Tech) operating inside real clinics today and scaling quickly across LATAM—building a category-defining company.

The Role

Shape a running agent platform into a clinician-grade product and an agent-native EHR. Extend configurable per-clinic workflows, connect them to a FHIR data spine, and help ship focused React/TypeScript surfaces where they unlock daily operations. Your work automates transcription and data entry, streamlines patient operations, and replaces legacy EHR modules over time. Senior IC on a CET-centric team with a high bar for performance and craft.

What You’ll Do
Expand configurable clinic workflows so agents automate real work: intake, transcription, data capture, scheduling, and follow-ups.
Implement a practical FHIR interop layer (via Medplum) for core resources—Patient, Appointment, Encounter, Practitioner, Location, Consent, DocumentReference.
Build migration and integration tooling to bring data from legacy EHRs/schedulers into our model/FHIR with validation, dry-runs, and safe rollbacks.
Deliver thin, fast operator/EHR surfaces in React/TypeScript (patient registry, timeline, appointments board, consent tracker) that clinicians actually use.
Raise observability and reliability across the platform with clear SLOs, tracing, actionable logs, and privacy/audit boundaries by tenant.
Improve developer ergonomics: local dev harnesses, golden datasets, CI gates that prevent regressions, and lightweight docs that speed onboarding.
Partner with Solutions Engineering to translate real clinic workflows into reusable building blocks; set a high bar in design and code reviews.
You Are
A senior IC who owns outcomes end-to-end and ships production quality.
A systems-plus-product thinker: you model workflows, design clear APIs/data models, and keep things simple.
Fast, pragmatic, and 80/20 by default—small slices, quick iterations, measurable impact.
High bar for performance and craft: testing discipline, thoughtful abstractions, solid DX.
Backend-first: able to contribute to front-end when it unlocks value.
Security-minded and careful with patient data; you respect boundaries and audits.
Collaborative and direct: crisp design docs, clear async communication, strong code reviews.
Comfortable with ambiguity and changing requirements; CET-friendly working hours.
Minimum Qualifications
Senior-level impact in production systems (typically 3–5+ years); Staff-track experience welcome.
1+ years of experience at a venture backed startup.
Strong Python with async fundamentals (asyncio), type safety, and packaging.
Event-driven backends and background jobs (queues, scheduling, retries) and resilient data sync between systems.
Postgres expertise: schema design, migrations, indexing, transactional integrity.
Integrations/ETL: import/export pipelines with validation, auditability, and safe rollback.
Infrastructure: GCP/GKE, Kubernetes/Helm, and Terraform (IaC) to design and operate cloud services.
CI/CD: ability to write GitHub Actions (or similar) workflows, add test/eval gates, and manage environment promotion.
Observability: traces/logs/metrics you actually use; define and hold SLOs; on-call ownership.
Security fundamentals: authN/authZ, multi-tenant separation, key/secret management.
Nice to Have
React/TypeScript front-end experience for operator/EHR surfaces.
FHIR R4 and/or Medplum; prior work with healthcare data models.
Data migration from legacy EHRs/schedulers; field mapping and reconciliation strategies.
OpenTelemetry, Metabase, Arize/Phoenix for model/ops monitoring.
Exposure to LATAM privacy/regulatory contexts (e.g., LFPDPPP, NOM-024/NOM-004).
Experience building operator/admin tools and lightweight internal platforms.
Our Tech Stack
Languages: Python, TypeScript
LLM APIs: OpenAI on Azure
Databases: PostgreSQL, Redis, S3, GCS
Cloud Providers and Infrastructure: AWS, GCP, Azure, Vercel
Dev Tools: Github, Docker, Kubernetes, Terraform
APIs & Middleware: FastAPI
Authentication & Authorization: Auth0
Monitoring & Logging: Phoenix Arize, Prometheus, Grafana
CI/CD: Github Actions
Collaboration: Slack, Notion, Attio, Lucidchart, Linear
BI Tools: Metabase
Working Model

Fully Remote. Team is primarily in CET but we work async globally

Compensation

Competitive + meaningful equity",,,New York City • Amsterdam,5+ years,1
1759d5a0f0dd5173ed4c0f93df109072,Deployment Engineer,,,Array,,,,,,,Wellfound,Wellfound,https://wellfound.com/jobs/2584968-deployment-engineer,国外,,,,,,1
53fffe44b89bab5ff861557e3cedd0fa,"Senior Product Designer and UX Researcher (Remote, 4-day week)",,,Stack Influence,,,,72-108K,,2026-01-06,Wellfound,Wellfound,https://wellfound.com/jobs/3695976-senior-product-designer-and-ux-researcher-remote-4-day-week,国外,"⚠️ ONLY APPLY THROUGH OUR APPLICATION FORM: https://stack-influence.breezy.hr/p/0dc7941cdd54/apply 👈

Stack Influence is a VC-funded creator marketplace app connecting eCommerce brands with everyday social media users. We are a high-growth, remote-first startup that offers a flexible 4-day work week.

You will own end-to-end product design while conducting research to understand user needs and drive product strategy.

We're looking for a high-impact individual contributor who can be the sole lead designer. You’ll collaborate with product and engineering leadership to shape the product roadmap.

Salary is between $120-180k USD with equity potential.

Responsibilities:

Design

Own end-to-end product design: discovery → concept → execution → launch → iteration
Create wireframes, prototypes and visual designs in Figma
Build and evolve design systems (components, patterns, guidelines) for consistency and scale
Collaborate with product and engineering to define requirements, not just translate them into design
Design and source brand-aligned visual assets for Marketing (website pages, decks, graphics)

Research

Lead and execute end-to-end studies—including qualitative interviews, surveys, and usability testing—to create product strategy based on user needs.
Collaborate with internal and external stakeholders to gather insight from various data sources
Synthesize research into actionable insights and recommendations (decks, narratives, visualizations)

Qualifications:

5+ years of product design experience
2+ years of UX research experience
Expert-level Figma skills
Portfolio demonstrating high-quality design (must include link in application)
Ability to work independently and manage competing priorities",,,,5+ years,1
